createdBy,assignedTo,createdAt,importanceLevel,closedAt,isResolved,subject,requestDetail
Syble76,Ilene.Blick73,Wed May 20 2020 17:38:55 GMT-0700 (Pacific Daylight Time),3,Mon Jan 31 2022 17:43:16 GMT-0800 (Pacific Standard Time),false,accusamus exercitationem doloribus,Deleniti temporibus magnam. Est sint id quia voluptas nostrum ut qui qui. Qui natus maxime. Nobis ea accusantium soluta nihil. Asperiores inventore sapiente illo esse inventore odit repudiandae et.
Ilene.Blick73,Meta_Moen,Fri Oct 23 2020 12:12:58 GMT-0700 (Pacific Daylight Time),2,Thu Sep 02 2021 05:08:07 GMT-0700 (Pacific Daylight Time),true,voluptatem a pariatur,Optio illum quos. At ut veniam eos alias voluptas consequatur. Quidem laboriosam cumque.
Jerome_OHara,Karlie75,Sat Aug 22 2020 04:53:20 GMT-0700 (Pacific Daylight Time),4,Mon Mar 15 2021 01:01:11 GMT-0700 (Pacific Daylight Time),true,voluptas nihil et,Voluptas occaecati quia veritatis animi enim. Harum sapiente magnam accusantium. Et perspiciatis distinctio rerum eveniet.
Tiara.Nicolas44,Hazle.Hahn18,Sun Dec 13 2020 07:30:51 GMT-0800 (Pacific Standard Time),2,Tue Sep 07 2021 03:03:44 GMT-0700 (Pacific Daylight Time),false,officia vitae fuga,Harum qui autem dicta fugiat harum ipsa qui impedit. Et quas labore. Culpa sit eligendi accusantium saepe inventore in vel qui. Dolorem rerum officiis. Dolor ut aliquam temporibus delectus quaerat omnis ea. Nam nobis consequatur quibusdam et cum consequatur nam quos sit.
Faustino_Gottlieb8,Sonny53,Sun Jun 14 2020 07:15:40 GMT-0700 (Pacific Daylight Time),2,Mon Jan 03 2022 03:22:49 GMT-0800 (Pacific Standard Time),false,est et et,Voluptatem atque ut omnis laudantium eaque et unde. In accusamus est aperiam atque et et ducimus animi delectus. Repellendus eveniet et aliquid ratione fugiat.
Janessa17,Tiara.Nicolas44,Thu Dec 10 2020 22:48:39 GMT-0800 (Pacific Standard Time),3,Wed Jul 14 2021 13:19:54 GMT-0700 (Pacific Daylight Time),false,fugit suscipit molestiae,Doloribus in neque ex aut corrupti quasi et ut. Cumque nobis atque aspernatur voluptatem voluptas possimus eum omnis. Aspernatur quas possimus velit repellat quam repellendus exercitationem modi et. Est necessitatibus molestiae omnis sapiente aut ut nulla et. Dolores consequatur rem suscipit consequatur iste ipsam eum dignissimos. Eligendi recusandae et consequatur repellat minus cumque consequatur dolores sit.
Syble76,Emmett.Macejkovic15,Wed Apr 08 2020 15:39:58 GMT-0700 (Pacific Daylight Time),0,Thu Oct 21 2021 21:43:02 GMT-0700 (Pacific Daylight Time),false,doloremque autem delectus,Labore quam et. Dolores inventore sed ratione reiciendis mollitia. Ad modi eius laborum dignissimos est aliquam. Velit dignissimos at voluptates neque.
Helene.Crist,Syble76,Thu Jan 14 2021 23:41:16 GMT-0800 (Pacific Standard Time),3,Wed Jul 28 2021 17:56:32 GMT-0700 (Pacific Daylight Time),true,minus et officia,Qui quos placeat ut ut rerum commodi. Corporis quaerat laudantium rerum quam quo id velit quasi. Itaque nostrum nemo. Repudiandae at sequi corporis. Dolor voluptatum sequi deserunt.
Westley.Zulauf26,Faustino_Gottlieb8,Sun Sep 27 2020 20:55:43 GMT-0700 (Pacific Daylight Time),3,Mon Nov 08 2021 17:28:16 GMT-0800 (Pacific Standard Time),true,alias molestiae vel,Dolore et et nisi temporibus. Sit omnis ut quibusdam dolor sapiente aperiam reprehenderit aut. Praesentium voluptate et voluptas optio porro rerum. Ut possimus repudiandae nihil omnis magnam ut laudantium. Ea alias dolorem. Iste id dolor in ut ducimus.
Karlie75,Ilene.Blick73,Fri Jan 01 2021 11:15:05 GMT-0800 (Pacific Standard Time),2,Fri Apr 02 2021 03:10:03 GMT-0700 (Pacific Daylight Time),true,quos repudiandae labore,Laudantium facere est alias nesciunt qui dolorem nisi magnam ea. Dolores sapiente molestias ex ullam veritatis. Sit distinctio nulla. Et quia nemo et porro voluptatem repellendus quia veritatis. Dolores sint non a.
Jerome_OHara,Ilene.Blick73,Mon Dec 28 2020 07:42:28 GMT-0800 (Pacific Standard Time),3,Sun Oct 31 2021 10:59:50 GMT-0700 (Pacific Daylight Time),false,nostrum praesentium animi,Aut neque praesentium atque voluptatem deleniti sint quia. Aut amet et libero sequi. Animi fuga sint. Nihil facilis dolor similique sapiente. Explicabo dignissimos aperiam sunt atque voluptas illo sint qui.
Faustino_Gottlieb8,Hazle.Hahn18,Thu Oct 08 2020 09:15:31 GMT-0700 (Pacific Daylight Time),0,Wed Feb 02 2022 06:32:02 GMT-0800 (Pacific Standard Time),true,ipsam reiciendis labore,Est aut assumenda quia et ea neque natus atque. Non veritatis sit exercitationem harum quod dicta qui facere placeat. Maiores aliquam omnis ut. Ipsa dolore hic ipsum et odio quibusdam error sit in. Consequatur et eum qui doloribus voluptas quasi sit enim quidem. Quaerat omnis dolorum est incidunt cumque et laboriosam nisi aut.
Karlie75,Emmett.Macejkovic15,Tue Aug 04 2020 20:07:43 GMT-0700 (Pacific Daylight Time),4,Thu Sep 09 2021 13:49:40 GMT-0700 (Pacific Daylight Time),true,quo impedit omnis,Dolor dolorum et. Enim cumque autem quia harum totam minima sit necessitatibus. Tenetur quidem similique voluptatem laborum consequatur. Laudantium mollitia eaque vero sit repudiandae nemo impedit.
Emmett.Macejkovic15,Emmett.Macejkovic15,Mon Nov 16 2020 20:35:43 GMT-0800 (Pacific Standard Time),4,Wed Jul 07 2021 03:58:09 GMT-0700 (Pacific Daylight Time),false,voluptatem tempora distinctio,Repellendus et ad adipisci iure consequatur perferendis sunt error. Animi perferendis quasi corrupti modi. Quia deserunt adipisci quis. Ex est cumque enim quo molestiae ad. Quia qui odit. Dolor rerum modi qui officiis recusandae et saepe quam aut.
Karlie75,Syble76,Thu Feb 27 2020 22:24:39 GMT-0800 (Pacific Standard Time),3,Mon Jan 24 2022 05:53:52 GMT-0800 (Pacific Standard Time),true,ratione ut praesentium,Voluptatem fugiat vel minus nam et. Sapiente perferendis nulla id. Quo modi aperiam at ut quia nihil nihil voluptas.
Thalia89,Ilene.Blick73,Tue May 05 2020 13:59:11 GMT-0700 (Pacific Daylight Time),4,Thu Aug 12 2021 23:38:20 GMT-0700 (Pacific Daylight Time),false,nihil reprehenderit et,Rem necessitatibus ea at rem ut est. Quia dicta aut accusamus optio. Enim necessitatibus consequuntur. Ut sit nemo ut officiis magnam quidem asperiores repudiandae quos. Enim consequuntur est excepturi sed.
Syble76,Tiara.Nicolas44,Sun May 31 2020 17:17:17 GMT-0700 (Pacific Daylight Time),0,Thu Jul 29 2021 20:31:38 GMT-0700 (Pacific Daylight Time),false,saepe expedita nemo,Quae explicabo totam sunt culpa nihil libero hic. Laboriosam sint in asperiores rerum dolorem dolor accusantium similique. Est est libero quis at qui id aut laudantium.
Tiara.Nicolas44,Thalia89,Sun Jan 31 2021 05:12:28 GMT-0800 (Pacific Standard Time),0,Tue Oct 05 2021 02:55:54 GMT-0700 (Pacific Daylight Time),false,nisi dolore laudantium,Non autem aut vel aliquid hic vero id. Aut fugit veniam voluptatum quibusdam reprehenderit optio velit. Suscipit sint provident ratione et id sed eveniet velit. Voluptate placeat animi asperiores ut id temporibus laborum sed veritatis. Velit aperiam iusto deleniti minima. Accusamus ad nulla ab.
Tiara.Nicolas44,Ilene.Blick73,Wed Nov 04 2020 18:04:28 GMT-0800 (Pacific Standard Time),3,Fri Nov 19 2021 18:11:59 GMT-0800 (Pacific Standard Time),false,enim non placeat,Enim aperiam sit corporis laborum ut eius. Voluptatem sed quis. Quo quam et sint id sint molestias rerum optio est.
Jerome_OHara,Syble76,Tue Dec 22 2020 04:12:22 GMT-0800 (Pacific Standard Time),0,Sat Mar 06 2021 15:16:58 GMT-0800 (Pacific Standard Time),true,dicta dolorem soluta,At fuga temporibus enim numquam. Nihil enim dolore. Earum voluptas at ea quia ut dolorem possimus quia. Et aut quo id. Porro rerum molestias labore recusandae et odio. Iure tempora aperiam ipsum quis.
Karlie75,Thalia89,Mon Jun 08 2020 17:38:18 GMT-0700 (Pacific Daylight Time),0,Fri May 28 2021 04:38:19 GMT-0700 (Pacific Daylight Time),false,non voluptas vitae,Qui exercitationem vero nostrum sed libero nulla mollitia enim consequatur. Consequatur inventore atque. Consectetur consequatur perferendis fugiat veritatis temporibus enim voluptatibus quam.
Jerome_OHara,Janessa17,Mon Nov 23 2020 22:16:48 GMT-0800 (Pacific Standard Time),3,Mon Sep 20 2021 13:20:52 GMT-0700 (Pacific Daylight Time),false,repudiandae fugiat dolore,Possimus recusandae totam nostrum blanditiis esse et. Repudiandae et omnis omnis doloremque et dolorum sunt. Ut atque excepturi nesciunt quas doloribus qui iure nulla atque. In natus nam repellendus numquam ut similique qui cupiditate inventore. Veniam enim sed laudantium voluptatem aut sit.
Janessa17,Faustino_Gottlieb8,Sun Jan 10 2021 20:07:45 GMT-0800 (Pacific Standard Time),1,Tue Sep 07 2021 09:39:42 GMT-0700 (Pacific Daylight Time),false,iusto asperiores est,Velit blanditiis quisquam ut nam cupiditate nostrum id. Doloremque doloremque illo vero laborum. Omnis dolor velit voluptas voluptates impedit vel. Beatae eum necessitatibus eum illum et laudantium non voluptatem est.
Jerome_OHara,Janessa17,Wed Oct 14 2020 00:08:58 GMT-0700 (Pacific Daylight Time),2,Tue Nov 09 2021 05:07:11 GMT-0800 (Pacific Standard Time),false,quis et eveniet,Provident est rem autem nulla praesentium non omnis perspiciatis quia. Officia iusto unde ut. Ab rerum aut. Quia ut vel.
Meta_Moen,Sonny53,Thu Jun 04 2020 15:16:21 GMT-0700 (Pacific Daylight Time),4,Sun Aug 29 2021 13:46:47 GMT-0700 (Pacific Daylight Time),false,iste beatae culpa,Aut dolor at. Asperiores autem cupiditate voluptas. Consequatur enim eaque animi consequuntur numquam recusandae. Voluptas inventore quis laborum itaque. Quaerat qui laborum placeat et voluptas perspiciatis ab necessitatibus.
Carole_Jones,Faustino_Gottlieb8,Thu Nov 26 2020 10:44:44 GMT-0800 (Pacific Standard Time),1,Wed Apr 28 2021 11:18:32 GMT-0700 (Pacific Daylight Time),true,sapiente voluptas omnis,Expedita suscipit eaque neque. Reiciendis itaque expedita saepe doloremque accusantium. Et corporis molestias et.
Thalia89,Hazle.Hahn18,Thu Mar 05 2020 15:06:05 GMT-0800 (Pacific Standard Time),4,Wed Apr 07 2021 10:18:18 GMT-0700 (Pacific Daylight Time),false,ducimus magnam est,Amet voluptatem voluptatem rerum. Occaecati sunt quae ut maiores amet neque est fugit. Omnis et deserunt sapiente est aliquam est veniam et sapiente. Voluptatem maxime consequuntur laborum possimus tenetur voluptas quidem placeat amet.
Emmett.Macejkovic15,Tiara.Nicolas44,Mon Jul 20 2020 19:45:26 GMT-0700 (Pacific Daylight Time),4,Tue Sep 28 2021 09:52:20 GMT-0700 (Pacific Daylight Time),false,totam hic assumenda,Dolor deleniti aut rem accusantium cumque enim. Ut temporibus nam ipsum aut ex. Assumenda sed adipisci nihil ea optio corporis. Doloribus officia voluptate qui omnis culpa voluptatum. Odit voluptatem vel debitis.
Syble76,Helene.Crist,Sun Nov 15 2020 18:27:16 GMT-0800 (Pacific Standard Time),0,Fri Sep 24 2021 00:33:12 GMT-0700 (Pacific Daylight Time),false,ut reprehenderit ut,Et voluptates ut rem. Consequatur dolorem reiciendis ut dolor delectus ad. Consequatur quia quia sed culpa tempore impedit labore quia.
Karlie75,Helene.Crist,Tue Oct 06 2020 19:15:42 GMT-0700 (Pacific Daylight Time),3,Wed Nov 24 2021 20:42:11 GMT-0800 (Pacific Standard Time),false,illum consequatur rerum,Laboriosam et illum qui rerum quos. In quidem id accusantium quod accusantium omnis quae. Fugiat eveniet maxime similique placeat sunt et et. Harum delectus aliquid qui eius velit eum. Sed distinctio laborum autem modi. Voluptatem amet totam non velit aliquam nihil.
Westley.Zulauf26,Syble76,Tue Jul 28 2020 06:36:53 GMT-0700 (Pacific Daylight Time),3,Thu Oct 07 2021 06:37:47 GMT-0700 (Pacific Daylight Time),true,reprehenderit nisi ut,Omnis reprehenderit velit voluptas enim. Numquam dolor mollitia autem nesciunt sunt. Voluptas doloremque at ut et sunt. Ab quam quia ab.
