createdBy,assignedTo,createdAt,importanceLevel,closedAt,isResolved,subject,requestDetail
Faustino_Gottlieb8,Ilene.Blick73,Sun Feb 09 2020 22:53:21 GMT-0800 (Pacific Standard Time),0,Thu Mar 11 2021 10:51:48 GMT-0800 (Pacific Standard Time),false,similique et sunt,Fuga consequatur eos voluptas sint dolorem labore repudiandae rerum consectetur. Debitis consectetur dicta cumque quo dolore. Commodi numquam explicabo ea sapiente aut natus voluptatem non voluptatem. Id aut ut enim impedit esse. Exercitationem aliquam labore quia eos quasi.
Karlie75,Ilene.Blick73,Fri Nov 06 2020 12:18:28 GMT-0800 (Pacific Standard Time),2,Fri Jan 28 2022 21:55:41 GMT-0800 (Pacific Standard Time),false,inventore qui quis,Fuga vel aut. Itaque voluptatum voluptatem. Saepe magnam nisi consequuntur tenetur voluptatem est hic. Odio ipsum aut et voluptatem quae est sint aliquam soluta. Architecto corrupti voluptatem et ipsam qui voluptatum alias non explicabo.
Sonny53,Faustino_Gottlieb8,Tue Dec 01 2020 17:35:09 GMT-0800 (Pacific Standard Time),3,Sat Jan 08 2022 20:45:33 GMT-0800 (Pacific Standard Time),false,enim quia voluptas,Quia enim ab tenetur. Sed explicabo placeat dolorem similique suscipit iure numquam id. Recusandae et autem qui sapiente. Est saepe ut ut totam assumenda quibusdam quia eligendi. Omnis recusandae velit quos tempora sit quibusdam et minus. Recusandae vero ipsum natus sit eos excepturi accusantium expedita.
Ilene.Blick73,Meta_Moen,Wed Dec 02 2020 10:58:05 GMT-0800 (Pacific Standard Time),0,Wed Mar 24 2021 10:44:02 GMT-0700 (Pacific Daylight Time),false,dolores aut neque,Consequuntur odit quo. Doloribus sapiente provident voluptatem aliquid expedita. Placeat sapiente fugit odit consequatur quos impedit hic et quia. Ratione laudantium labore aut quibusdam.
Tiara.Nicolas44,Tiara.Nicolas44,Sat Jan 23 2021 10:12:54 GMT-0800 (Pacific Standard Time),4,Tue Mar 02 2021 06:00:18 GMT-0800 (Pacific Standard Time),true,vitae assumenda impedit,Aut aut laboriosam voluptatem consequatur laudantium voluptatum ea. Odit cum et qui maiores totam laboriosam eaque. Qui totam ut fugit aut incidunt.
Thalia89,Helene.Crist,Wed Jun 03 2020 21:14:56 GMT-0700 (Pacific Daylight Time),3,Sat Jan 29 2022 17:56:43 GMT-0800 (Pacific Standard Time),true,voluptas occaecati explicabo,Esse qui in accusantium maiores quis quaerat aliquam qui. Quia sit sint suscipit perferendis. Voluptas debitis perferendis alias sed.
Westley.Zulauf26,Janessa17,Thu Mar 19 2020 18:26:15 GMT-0700 (Pacific Daylight Time),1,Thu Sep 23 2021 23:34:08 GMT-0700 (Pacific Daylight Time),true,amet voluptas perspiciatis,Eius quidem earum rerum nemo et sint ab repellat. Dolores quisquam nesciunt esse odio fugiat et. Occaecati adipisci nisi hic atque deserunt a odit ipsam voluptas. Sed quaerat ducimus libero nisi.
Tiara.Nicolas44,Ilene.Blick73,Mon Jul 13 2020 04:40:25 GMT-0700 (Pacific Daylight Time),4,Wed Oct 13 2021 08:08:35 GMT-0700 (Pacific Daylight Time),false,est aut beatae,Qui est dolor sequi corporis. Tempora quis vitae eveniet aperiam sit ut reprehenderit pariatur debitis. Rerum ut minima. Ea sint est quasi nesciunt nisi. Quis itaque voluptatem a. Odit provident dicta nisi voluptatem eum tenetur.
Meta_Moen,Ilene.Blick73,Sat Jun 13 2020 14:48:56 GMT-0700 (Pacific Daylight Time),1,Sun Apr 18 2021 07:57:15 GMT-0700 (Pacific Daylight Time),true,et est saepe,Id voluptas et asperiores nisi possimus. Quae quo ut nihil qui aut sunt nobis. Nesciunt soluta in aliquam omnis. Aut aut veritatis qui reprehenderit voluptas quis velit non consequatur. Tempora dolorem non nemo et.
Janessa17,Karlie75,Thu Sep 03 2020 18:42:59 GMT-0700 (Pacific Daylight Time),3,Wed Jun 23 2021 09:37:42 GMT-0700 (Pacific Daylight Time),false,possimus animi natus,Debitis autem molestiae. Rem numquam ipsam dolor sint. Voluptatem saepe dicta laborum et minus quaerat. Id laborum rerum rerum deleniti tempore occaecati. Qui quisquam excepturi itaque consectetur placeat placeat. Iusto et accusantium.
Syble76,Hazle.Hahn18,Sun Sep 20 2020 23:23:50 GMT-0700 (Pacific Daylight Time),4,Tue Jan 18 2022 12:33:06 GMT-0800 (Pacific Standard Time),false,aut sint est,Aspernatur esse ad est dicta incidunt suscipit labore laborum. Libero itaque enim ducimus aut sit neque voluptatem. Deleniti eaque placeat. Eius eligendi porro ut exercitationem ut ab deserunt quia consequatur. Aut magnam consectetur cupiditate enim necessitatibus eos quibusdam perferendis ipsam. Iusto et adipisci et neque et id.
Karlie75,Westley.Zulauf26,Thu Sep 17 2020 07:02:14 GMT-0700 (Pacific Daylight Time),4,Wed Aug 18 2021 19:53:56 GMT-0700 (Pacific Daylight Time),false,est at et,Occaecati et repellendus et est harum velit dolore beatae. Ad culpa est reiciendis et vel voluptas. Illum quae labore sint. Et laudantium aspernatur velit.
Faustino_Gottlieb8,Ilene.Blick73,Mon Sep 21 2020 08:34:43 GMT-0700 (Pacific Daylight Time),1,Sat Sep 18 2021 10:54:46 GMT-0700 (Pacific Daylight Time),false,mollitia laudantium et,Accusantium reiciendis architecto eum quo quia. Saepe doloremque eos. Corrupti quo et voluptas iusto. Sit pariatur id iusto sit. Aperiam ut atque magnam. Quasi qui deleniti dicta ex nobis suscipit modi in.
Emmett.Macejkovic15,Janessa17,Thu Jul 09 2020 17:30:00 GMT-0700 (Pacific Daylight Time),0,Fri Oct 22 2021 05:39:57 GMT-0700 (Pacific Daylight Time),true,dolores beatae quae,Voluptatem veritatis sequi et consequuntur occaecati sed exercitationem similique asperiores. Saepe quos alias illum quasi quidem ut et. Aut nihil qui rerum voluptas cum.
Janessa17,Ilene.Blick73,Fri May 29 2020 04:58:27 GMT-0700 (Pacific Daylight Time),3,Fri Jul 30 2021 07:58:50 GMT-0700 (Pacific Daylight Time),false,consequatur vero est,In deserunt dolor dolores aut iste fugit necessitatibus. Sapiente dolor quibusdam quia voluptas tempora velit asperiores molestiae. Quo distinctio odit quia sed sed officiis fugiat. Eligendi rerum ad labore dolorem eum. Aut quia nam et et laboriosam provident id.
Hazle.Hahn18,Westley.Zulauf26,Sat Mar 07 2020 20:36:39 GMT-0800 (Pacific Standard Time),4,Fri Apr 09 2021 20:14:00 GMT-0700 (Pacific Daylight Time),false,libero qui fugit,Facilis aut quis est earum. Eius voluptatum et debitis. Itaque sequi voluptatibus dolor consequatur. Consectetur aut porro nisi consequuntur qui alias asperiores temporibus.
Thalia89,Meta_Moen,Sun Nov 22 2020 10:14:58 GMT-0800 (Pacific Standard Time),0,Thu Dec 16 2021 13:45:01 GMT-0800 (Pacific Standard Time),true,ipsa est rerum,Pariatur tempora provident aut. Assumenda accusantium dignissimos itaque expedita. Quo dolore adipisci pariatur temporibus.
Meta_Moen,Jerome_OHara,Thu Sep 10 2020 06:25:15 GMT-0700 (Pacific Daylight Time),3,Tue Sep 28 2021 05:26:54 GMT-0700 (Pacific Daylight Time),true,eum ea magnam,Architecto nulla sit facilis qui. Eos enim et vel velit et vel repellendus. Beatae eius animi repudiandae aut. Dignissimos necessitatibus enim ut minima aspernatur in. Est architecto quod quaerat et consequatur corporis eveniet voluptate aut. Et dolorem aut distinctio.
Emmett.Macejkovic15,Karlie75,Thu Feb 04 2021 10:46:00 GMT-0800 (Pacific Standard Time),3,Tue Jun 29 2021 02:51:28 GMT-0700 (Pacific Daylight Time),true,assumenda culpa dolor,Vero et tempora qui et omnis fugiat deserunt. Labore qui deleniti natus animi neque asperiores impedit nesciunt porro. Exercitationem vitae explicabo iure.
Syble76,Syble76,Fri May 08 2020 12:02:47 GMT-0700 (Pacific Daylight Time),1,Wed May 26 2021 12:19:22 GMT-0700 (Pacific Daylight Time),false,quo quo nesciunt,Ea voluptas non ad eos repellendus fugit. Commodi expedita vitae eveniet et. Qui eveniet labore accusamus omnis atque vero officia aut.
Thalia89,Thalia89,Tue May 19 2020 05:38:09 GMT-0700 (Pacific Daylight Time),0,Fri Oct 08 2021 20:34:37 GMT-0700 (Pacific Daylight Time),false,at voluptatem aut,Aut excepturi est quam beatae tenetur qui nisi. Tempore maiores rem. Et impedit molestiae asperiores aut id soluta velit. Maiores reiciendis fugiat aut assumenda. Explicabo perspiciatis aut nihil maxime velit.
Syble76,Sonny53,Fri Nov 20 2020 23:18:49 GMT-0800 (Pacific Standard Time),0,Sat Feb 05 2022 12:44:13 GMT-0800 (Pacific Standard Time),true,facilis et alias,Tempore sunt in quas suscipit. Minima modi natus. Incidunt et voluptas. Maiores neque illo quis. Amet dolorem animi odit.
Carole_Jones,Hazle.Hahn18,Fri Sep 04 2020 16:26:45 GMT-0700 (Pacific Daylight Time),3,Tue Feb 23 2021 18:26:58 GMT-0800 (Pacific Standard Time),false,aut magnam perspiciatis,Ad eligendi qui. Id corrupti ad quae eligendi rerum incidunt consequatur. Placeat rerum ut aut nemo deleniti nobis sed. Repellat eos et ab repudiandae architecto fugit.
Carole_Jones,Emmett.Macejkovic15,Thu Jul 16 2020 22:09:01 GMT-0700 (Pacific Daylight Time),0,Thu Dec 02 2021 22:44:56 GMT-0800 (Pacific Standard Time),false,dolor optio quia,Repudiandae asperiores esse nulla nostrum eligendi ipsum deleniti. Aliquid animi aut sed et aut. Totam omnis est explicabo repellendus vitae odio.
Tiara.Nicolas44,Hazle.Hahn18,Sun Jun 21 2020 20:40:23 GMT-0700 (Pacific Daylight Time),2,Tue Jun 15 2021 09:41:33 GMT-0700 (Pacific Daylight Time),false,dignissimos ea rerum,Et sed reprehenderit ratione nam voluptatem molestiae delectus earum nulla. Sed quae et possimus aut. Error maxime id repellat corrupti et nam. Veniam accusamus quidem aut eligendi ut et voluptas nulla atque. Nostrum repellat eius ea ducimus id eveniet.
Hazle.Hahn18,Meta_Moen,Tue Mar 03 2020 15:54:47 GMT-0800 (Pacific Standard Time),1,Wed Aug 25 2021 01:43:28 GMT-0700 (Pacific Daylight Time),false,qui itaque magni,Suscipit aut voluptatem aut illo nihil corporis aut dolor libero. Omnis quibusdam harum ducimus voluptate maxime quod. Voluptatibus eos consequatur voluptate illo dolor dolore. Facilis similique aut velit delectus labore sequi ducimus dolorum. Et consequatur voluptatem consectetur recusandae rerum. Quam fugit saepe rem corporis.
Faustino_Gottlieb8,Sonny53,Thu Dec 31 2020 01:36:33 GMT-0800 (Pacific Standard Time),3,Tue Aug 10 2021 04:41:47 GMT-0700 (Pacific Daylight Time),true,illum id qui,Voluptates provident voluptas voluptas quis ipsa ut dolores ut debitis. Illo dignissimos sed. Officiis repellat corrupti eaque. Aspernatur pariatur vel alias nostrum et libero.
Hazle.Hahn18,Emmett.Macejkovic15,Fri Jul 31 2020 17:50:09 GMT-0700 (Pacific Daylight Time),3,Mon Dec 06 2021 17:13:44 GMT-0800 (Pacific Standard Time),false,repudiandae ut numquam,Dolorum aperiam eveniet dolores sed quia velit praesentium eum. Ut nihil atque aut tempore assumenda. Occaecati numquam debitis optio eaque nesciunt.
Westley.Zulauf26,Emmett.Macejkovic15,Tue Dec 22 2020 17:11:14 GMT-0800 (Pacific Standard Time),2,Fri Apr 02 2021 18:32:41 GMT-0700 (Pacific Daylight Time),false,molestias id quas,Voluptatum rerum recusandae. Illum hic dignissimos. Qui nobis blanditiis. Enim totam ea omnis quas nam corporis est.
Sonny53,Carole_Jones,Fri Jan 08 2021 14:25:12 GMT-0800 (Pacific Standard Time),1,Sat Dec 04 2021 22:44:06 GMT-0800 (Pacific Standard Time),true,neque ut et,Nobis reprehenderit libero nihil. Magnam ut qui quae accusamus. Dicta est qui rerum exercitationem dolores dolorem occaecati.
Tiara.Nicolas44,Tiara.Nicolas44,Fri Oct 09 2020 20:19:07 GMT-0700 (Pacific Daylight Time),0,Sat Jan 01 2022 19:27:39 GMT-0800 (Pacific Standard Time),false,atque omnis explicabo,Est hic vel quis aut sed omnis. Dolor quaerat ratione aut ipsam dolores eum enim ut veritatis. Est laudantium iure eos distinctio. Est non molestiae voluptatibus cumque dolor ea.
Tiara.Nicolas44,Karlie75,Tue Aug 25 2020 06:29:11 GMT-0700 (Pacific Daylight Time),0,Sun Apr 11 2021 11:00:35 GMT-0700 (Pacific Daylight Time),true,occaecati sit similique,Officia praesentium voluptatem culpa. Et et dignissimos ipsa officia dicta quaerat similique. Voluptas quis debitis fugit mollitia laudantium quia laboriosam repudiandae. Non est quis distinctio qui nesciunt repellendus ut expedita ut.
Helene.Crist,Faustino_Gottlieb8,Mon Sep 28 2020 13:54:47 GMT-0700 (Pacific Daylight Time),2,Sun Jun 06 2021 13:18:44 GMT-0700 (Pacific Daylight Time),false,amet qui ea,Voluptas sed cupiditate totam quia maiores voluptatem consequuntur modi. Mollitia aliquid corrupti maiores. Ipsa atque officia nobis nesciunt voluptates. Reiciendis facilis eos.
Carole_Jones,Thalia89,Sun Apr 19 2020 20:46:17 GMT-0700 (Pacific Daylight Time),4,Mon Sep 20 2021 21:53:06 GMT-0700 (Pacific Daylight Time),false,excepturi quisquam ut,Quia atque doloribus adipisci odit maxime laborum quam. Sunt est natus. Aut maiores quae sit hic tenetur id ab. Maxime nulla sint quis quidem.
Jerome_OHara,Karlie75,Tue Jul 28 2020 10:36:34 GMT-0700 (Pacific Daylight Time),0,Sat Dec 11 2021 13:30:40 GMT-0800 (Pacific Standard Time),false,eum non explicabo,Et fuga similique. Quos qui voluptatibus minus ex doloribus. Perferendis odio amet aut deleniti amet odio delectus. Incidunt eum dolorum. Tempora qui impedit ex molestias rem.
Helene.Crist,Jerome_OHara,Tue Oct 20 2020 19:38:04 GMT-0700 (Pacific Daylight Time),0,Thu Oct 28 2021 02:38:11 GMT-0700 (Pacific Daylight Time),false,voluptas temporibus nihil,Hic debitis eos eaque corporis ipsa distinctio. Quibusdam aliquid sit quia. Nesciunt placeat sed assumenda omnis eos optio quod. Ut et delectus totam omnis numquam eum soluta. Illum quisquam nihil quibusdam sed ea quia sunt repellat molestiae. Harum non beatae quidem eum non.
Sonny53,Ilene.Blick73,Sun Mar 08 2020 05:41:23 GMT-0700 (Pacific Daylight Time),0,Fri Jan 14 2022 18:25:30 GMT-0800 (Pacific Standard Time),true,dolorem molestiae eum,Illo fugit beatae illo repellat laboriosam corporis tenetur laborum exercitationem. Aut ipsum commodi assumenda. Ipsam voluptatem est beatae nihil perferendis est similique. Repudiandae expedita et dolores voluptas optio. Et qui tenetur impedit dolores quidem magnam nam. Aut ullam repudiandae.
Carole_Jones,Helene.Crist,Sun Oct 11 2020 00:13:50 GMT-0700 (Pacific Daylight Time),3,Wed Mar 24 2021 20:52:16 GMT-0700 (Pacific Daylight Time),true,dolores numquam dolorum,Rem culpa quod. Ut reiciendis enim aspernatur ea distinctio fuga ea. Et dolore vitae reiciendis qui.
Helene.Crist,Jerome_OHara,Fri May 01 2020 00:14:51 GMT-0700 (Pacific Daylight Time),0,Tue Nov 30 2021 01:08:41 GMT-0800 (Pacific Standard Time),false,asperiores dolorem ad,Officiis aliquid vel dolore tempora. Nihil accusantium exercitationem totam voluptas rerum maxime blanditiis. Quasi necessitatibus fugit ipsam velit ex nihil. Dicta nostrum explicabo ut quisquam asperiores nemo. Dolores omnis nam pariatur. Magnam facilis consequatur.
Westley.Zulauf26,Ilene.Blick73,Mon Jan 18 2021 10:46:40 GMT-0800 (Pacific Standard Time),1,Thu Apr 01 2021 14:12:41 GMT-0700 (Pacific Daylight Time),false,possimus laudantium et,Consectetur ad qui eius dolores adipisci. Quae quae accusantium. Excepturi dolor cumque voluptas explicabo. Repudiandae aut atque consequatur sunt et distinctio.
Ilene.Blick73,Tiara.Nicolas44,Mon Jun 22 2020 02:38:18 GMT-0700 (Pacific Daylight Time),4,Tue May 25 2021 14:30:55 GMT-0700 (Pacific Daylight Time),true,occaecati pariatur impedit,Vel repudiandae quidem est blanditiis quod qui quae iure. Dolor eum illo veniam voluptatum soluta modi unde. Reiciendis sed voluptas dolor omnis at. Veniam temporibus velit quibusdam fugiat occaecati itaque quod quia. Quia dolorem dolore.
Ilene.Blick73,Emmett.Macejkovic15,Thu Sep 10 2020 01:30:45 GMT-0700 (Pacific Daylight Time),4,Mon Dec 06 2021 05:29:26 GMT-0800 (Pacific Standard Time),true,suscipit ea vero,Nihil quae accusantium et sequi nostrum nihil quia asperiores atque. Cumque magni sunt eos quis ipsa enim numquam. Alias velit eum dicta repudiandae. Laborum vitae veritatis id fuga. Ut neque perspiciatis autem.
Thalia89,Emmett.Macejkovic15,Mon Oct 12 2020 22:49:39 GMT-0700 (Pacific Daylight Time),2,Wed Sep 15 2021 10:28:10 GMT-0700 (Pacific Daylight Time),true,est quibusdam facilis,Molestiae vel modi corporis officiis aliquid expedita est ut pariatur. Et beatae aut nam cum voluptatum est ut deleniti consequatur. Alias ipsam et molestiae aut. Suscipit eligendi deleniti rem ut sunt et similique assumenda neque. Eligendi provident fugiat quo maiores omnis fugiat maxime. Odio non culpa.
Karlie75,Carole_Jones,Thu Oct 08 2020 22:21:19 GMT-0700 (Pacific Daylight Time),3,Mon Jan 31 2022 11:24:49 GMT-0800 (Pacific Standard Time),true,aut velit odio,Animi repellat distinctio tempore deleniti quo molestiae et. Vel rerum quia facere ducimus perferendis. Aspernatur et sint distinctio. Nobis nam id veniam nam voluptatum voluptas quisquam id voluptatem. Eveniet dolorem laboriosam ut tempora. Ut molestias illum consequatur tempore est dignissimos et.
Westley.Zulauf26,Carole_Jones,Sat May 30 2020 07:38:12 GMT-0700 (Pacific Daylight Time),4,Sat Apr 24 2021 20:26:19 GMT-0700 (Pacific Daylight Time),false,nostrum dicta ratione,Iste voluptatibus ut consequuntur at aut eaque. Nihil eligendi omnis qui ex dolores consequatur laborum delectus ex. Architecto quidem ullam. Dolorem corporis explicabo molestias aspernatur. Enim quas quasi ipsa. Delectus accusantium iure.
Sonny53,Meta_Moen,Sun May 10 2020 23:21:43 GMT-0700 (Pacific Daylight Time),0,Tue Aug 17 2021 10:36:26 GMT-0700 (Pacific Daylight Time),false,omnis laboriosam ut,Quibusdam quisquam dolorem a. Culpa a pariatur quo fugit ad sit. Eaque animi tempora laborum tenetur in eveniet reiciendis tempora laborum. Quo impedit fugit animi perspiciatis. In sunt omnis illo accusantium rem at autem autem modi.
Thalia89,Ilene.Blick73,Fri Sep 04 2020 22:18:28 GMT-0700 (Pacific Daylight Time),1,Wed Nov 17 2021 06:59:37 GMT-0800 (Pacific Standard Time),true,numquam expedita natus,Aperiam sit animi. Iure dolores inventore est quisquam omnis labore quas amet. Sunt distinctio et illum voluptates fugiat optio est ut. Magni necessitatibus repudiandae officiis ab veniam aut quia. Aut sed ipsa.
Hazle.Hahn18,Emmett.Macejkovic15,Fri Mar 06 2020 04:48:50 GMT-0800 (Pacific Standard Time),2,Fri Sep 10 2021 12:05:02 GMT-0700 (Pacific Daylight Time),true,eveniet amet voluptatem,Facere ab placeat aspernatur cum consequuntur in pariatur rerum. Autem dignissimos autem eius repellendus. Eos maiores cupiditate itaque ex accusamus quidem omnis saepe. Inventore et suscipit nam.
Karlie75,Helene.Crist,Thu Mar 26 2020 21:37:21 GMT-0700 (Pacific Daylight Time),0,Thu Oct 28 2021 08:08:25 GMT-0700 (Pacific Daylight Time),true,magni recusandae placeat,Est a dolore nesciunt delectus ullam voluptatem commodi ea sed. Sed dolorem molestiae cumque reiciendis alias nam consequatur. Quidem rem voluptatem. Molestiae maxime labore ducimus voluptatum totam sunt.
Sonny53,Thalia89,Mon Jul 27 2020 15:28:08 GMT-0700 (Pacific Daylight Time),4,Fri Dec 31 2021 14:55:41 GMT-0800 (Pacific Standard Time),false,facilis ut consequatur,Ut ad voluptatum. Et eaque deserunt voluptatibus quod rerum quia aut. Pariatur maxime ullam. Qui hic voluptate minima fugiat nulla occaecati rem. Omnis est repellendus est earum rerum. A numquam dolorum quia rem et aut qui numquam.
Tiara.Nicolas44,Thalia89,Thu Mar 19 2020 22:34:37 GMT-0700 (Pacific Daylight Time),0,Fri Apr 02 2021 21:14:04 GMT-0700 (Pacific Daylight Time),true,et atque numquam,Doloremque eos quis. Dignissimos eligendi consequatur. Quis error explicabo magni sit tempora eum molestias veritatis et. Nisi corrupti dolorum fugit non incidunt repellat exercitationem voluptates.
Thalia89,Emmett.Macejkovic15,Sun Jun 14 2020 01:21:10 GMT-0700 (Pacific Daylight Time),1,Thu Nov 18 2021 03:21:16 GMT-0800 (Pacific Standard Time),false,vel natus mollitia,Non et voluptatum reiciendis omnis laborum placeat et totam quis. Ipsum atque saepe sequi aut aut quae modi nihil. Ducimus et minus nobis aut recusandae commodi officia ratione. Ad dolorum aut quaerat qui voluptatem. Fuga vero blanditiis laborum accusamus illo maiores ut. Placeat voluptates quibusdam.
Tiara.Nicolas44,Westley.Zulauf26,Tue Mar 24 2020 19:27:43 GMT-0700 (Pacific Daylight Time),2,Sat Feb 20 2021 18:13:44 GMT-0800 (Pacific Standard Time),true,architecto nisi qui,Quasi molestiae ut. Officiis voluptas dolore eos voluptas voluptatem aliquam ratione non et. Enim dolorum possimus totam molestiae tempore reiciendis esse reprehenderit.
Jerome_OHara,Meta_Moen,Mon Jul 13 2020 15:43:22 GMT-0700 (Pacific Daylight Time),1,Mon Nov 22 2021 14:13:56 GMT-0800 (Pacific Standard Time),true,voluptas totam illum,Quo accusamus et rem laborum commodi aut et veritatis. Qui et odit sed maxime. Iste neque facilis sit. Suscipit consequuntur nulla consequatur ut aspernatur dignissimos eum voluptatem. Laudantium in ut saepe.
Emmett.Macejkovic15,Emmett.Macejkovic15,Wed Feb 12 2020 18:12:45 GMT-0800 (Pacific Standard Time),4,Sat Mar 13 2021 20:08:30 GMT-0800 (Pacific Standard Time),false,eaque ea non,Culpa voluptatibus nesciunt. Ut omnis voluptate sunt natus aut dolorem. Officia inventore quis nisi.
Ilene.Blick73,Meta_Moen,Fri Dec 18 2020 19:28:39 GMT-0800 (Pacific Standard Time),3,Mon Aug 09 2021 09:42:39 GMT-0700 (Pacific Daylight Time),false,ducimus nihil et,Aut aperiam ea quam. Enim omnis eum aut iste quibusdam consequatur. Sit mollitia enim aperiam qui voluptatem doloremque non. Voluptatem maxime vel. Et placeat et dolores. Dolore molestiae a eos minima modi assumenda.
Tiara.Nicolas44,Karlie75,Wed Nov 04 2020 02:01:26 GMT-0800 (Pacific Standard Time),0,Sat Apr 10 2021 17:29:31 GMT-0700 (Pacific Daylight Time),false,voluptas quia sapiente,Omnis ut et in temporibus veniam. Odit doloribus velit. Odio et rem nihil repudiandae quia qui illo. Sit ea amet ipsam nulla molestiae. Sint et qui nihil quia eius ea assumenda adipisci. Nam maxime provident omnis unde.
Sonny53,Meta_Moen,Fri May 08 2020 13:28:28 GMT-0700 (Pacific Daylight Time),1,Mon May 03 2021 11:32:36 GMT-0700 (Pacific Daylight Time),false,ut et et,Temporibus maxime id odio amet ipsam. Nihil magni eius ipsum minus ut. Quos at praesentium sint ea. Animi at assumenda qui corrupti quibusdam ducimus. Velit molestiae error. Nemo distinctio ea vel molestiae dolorem velit et velit recusandae.
Ilene.Blick73,Meta_Moen,Wed Jul 01 2020 17:34:26 GMT-0700 (Pacific Daylight Time),4,Wed Jan 12 2022 17:06:44 GMT-0800 (Pacific Standard Time),false,in quaerat consequatur,In maxime aliquam quibusdam accusantium qui voluptate natus corporis. Rem sed et corrupti tempore laudantium nobis et maxime. Labore aut impedit. Magni non cum voluptatibus nostrum.
Tiara.Nicolas44,Hazle.Hahn18,Fri Aug 21 2020 23:55:39 GMT-0700 (Pacific Daylight Time),4,Wed Mar 31 2021 01:43:09 GMT-0700 (Pacific Daylight Time),false,ut praesentium harum,Pariatur cum tempore eum ratione praesentium. Non quibusdam consequuntur aut aut omnis molestias ut corporis quidem. Corporis eveniet qui ducimus aperiam.
Janessa17,Jerome_OHara,Tue Jul 21 2020 22:39:32 GMT-0700 (Pacific Daylight Time),4,Sat Feb 05 2022 23:14:09 GMT-0800 (Pacific Standard Time),true,odit mollitia et,Incidunt doloribus non assumenda. Sequi est veritatis distinctio ex sit possimus. Doloribus deleniti et enim quis autem harum dolorem laboriosam maxime. Reprehenderit doloremque laborum nihil rerum quia tempora eos. Velit expedita delectus quis consequatur voluptatum ut.
Karlie75,Ilene.Blick73,Thu Apr 23 2020 08:05:17 GMT-0700 (Pacific Daylight Time),4,Sun Dec 19 2021 12:59:55 GMT-0800 (Pacific Standard Time),false,eum animi maiores,Harum non quam vitae labore voluptatem eaque laudantium aliquam molestiae. Sed laboriosam alias non et voluptatibus dolor quos nemo labore. Dolore non eveniet. Dolor molestias aut et sit repellendus voluptatibus voluptas. Quis unde aliquam.
Ilene.Blick73,Faustino_Gottlieb8,Sun Aug 30 2020 23:07:56 GMT-0700 (Pacific Daylight Time),3,Sat Aug 21 2021 11:43:00 GMT-0700 (Pacific Daylight Time),true,optio rerum eveniet,Qui quaerat alias quis libero cumque quos praesentium veniam. Ducimus molestiae et ea velit nemo. Pariatur velit nisi suscipit ullam deserunt quia mollitia enim voluptatem.
Faustino_Gottlieb8,Janessa17,Wed Jun 24 2020 16:27:10 GMT-0700 (Pacific Daylight Time),4,Sat Sep 18 2021 15:09:41 GMT-0700 (Pacific Daylight Time),true,non placeat ut,Temporibus earum quia sint illum quaerat saepe. Laboriosam reiciendis voluptas ut non qui optio nulla. Aliquam excepturi alias iusto molestias. Earum quisquam et dolores quia harum doloremque velit. Ex beatae perferendis accusamus quia nihil enim mollitia sint et.
Faustino_Gottlieb8,Tiara.Nicolas44,Fri May 29 2020 05:51:19 GMT-0700 (Pacific Daylight Time),2,Sat Jun 05 2021 19:40:31 GMT-0700 (Pacific Daylight Time),false,facilis veniam magni,Totam ullam quae quo odit voluptatem aliquid voluptatem quos earum. Non labore repellendus in. Asperiores quas iste. Vero fugiat non ducimus esse odit et temporibus dignissimos. Minus recusandae quos aut recusandae modi et tenetur deserunt cum.
Hazle.Hahn18,Tiara.Nicolas44,Sun Jan 03 2021 14:59:12 GMT-0800 (Pacific Standard Time),0,Mon May 03 2021 07:15:10 GMT-0700 (Pacific Daylight Time),false,voluptatem quia consectetur,Tenetur sint dolores magni eum similique. Enim ut dolores. Autem est ut sint eligendi sit cumque. Est aut ut amet quod in. Eligendi magnam ad voluptatem cum quam non maxime.
Hazle.Hahn18,Carole_Jones,Sun Oct 04 2020 01:03:23 GMT-0700 (Pacific Daylight Time),4,Fri Dec 10 2021 15:15:42 GMT-0800 (Pacific Standard Time),false,aliquam at sit,Necessitatibus fugit debitis aut mollitia expedita. Et omnis at. Alias non quod dolorem et perferendis omnis est. Ut quam laboriosam qui quaerat esse saepe nam et.
Thalia89,Helene.Crist,Thu Mar 26 2020 11:19:45 GMT-0700 (Pacific Daylight Time),0,Sun Mar 14 2021 18:59:24 GMT-0700 (Pacific Daylight Time),false,qui eos et,Voluptas in suscipit dolores necessitatibus molestiae ut velit. Non est quam ducimus et quasi. Ipsam cumque qui itaque et explicabo et unde voluptatem.
Meta_Moen,Meta_Moen,Sat Mar 14 2020 11:48:17 GMT-0700 (Pacific Daylight Time),2,Thu Nov 25 2021 18:12:28 GMT-0800 (Pacific Standard Time),false,et sapiente deleniti,Quidem veritatis explicabo voluptates iure. Explicabo aut dicta vitae vel id. Dignissimos nulla laborum adipisci nam dolores. Beatae ea reiciendis ut et laborum omnis aut eum quia.
